{
  "schema_version": "1",
  "id": "01J9ZSZABCDEFGHJKMNPQRSTVW",
  "trajectory_id": "01J9ZSZABCDEFGHJKMNPQRSTVX",
  "last_event_id": "01J9ZSZABCDEFGHJKMNPQRSTV0",
  "model_id": "gpt-4o",
  "provider_name": "openai",
  "system_prompt_hash": "sha256:e3b0c44298fc1c149afbf4c8996fb92427ae41e4649b934ca495991b7852b855",
  "memory_refs": ["user-role", "prefers-terse-responses"],
  "compaction_state": {
    "last_compacted_event_id": "01J9ZSZABCDEFGHJKMNPQRSTV1",
    "summary": "Early turns established user context; details compacted."
  },
  "created_at": "2026-04-17T12:00:00.000Z",
  "updated_at": "2026-04-17T14:30:00.000Z",
  "ext": {
    "experiment": { "run_tag": "ppo-2026-04-17-a" }
  }
}
